{
  "snapshot_type": "aof-organization-analytics",
  "snapshot_format_version": 1,
  "organization_ref": ".aof/organization.json",
  "generated_at": "2026-06-14T05:45:15.262Z",
  "task_flow": {
    "open_count": 1,
    "assigned_count": 0,
    "done_count": 26,
    "archived_count": 1,
    "retired_count": 0
  },
  "contract_health": {
    "declared_count": 3,
    "artifact_present_count": 3,
    "coverage_ratio": 1
  },
  "dependency_health": {
    "declared_count": 3,
    "active_count": 3,
    "bottleneck_ref_count": 0
  },
  "escalation_health": {
    "decision_count": 3,
    "unresolved_count": 0
  },
  "observations": [
    "No immediate organization bottleneck was detected from the current local artifact set."
  ]
}
